Symbol,Name,Last Sale,Net Change,% Change,Market Cap,Country,IPO Year,Volume,Sector,Industry
KLG,WK Kellogg Co Common Stock,$21.97,-2.30,-9.477%,1885412255.00,United States,2023,1853667,Consumer Staples,Packaged Foods
KMB,Kimberly-Clark Corporation Common Stock,$135.93,-0.05,-0.037%,45768864837.00,United States,,2180725,Consumer Discretionary,Containers/Packaging
KMI,Kinder Morgan Inc. Common Stock,$18.81,0.04,0.213%,41746622144.00,United States,2011,11639630,Utilities,Natural Gas Distribution
KMPB,Kemper Corporation 5.875% Fixed-Rate Reset Junior Subordinated Debentures due 2062,$22.35,-0.06,-0.268%,1438789117.00,United States,2022,9588,Finance,Property-Casualty Insurers
KMPR,Kemper Corporation,$60.40,0.03,0.05%,3888271261.00,United States,,216600,Finance,Property-Casualty Insurers
KMT,Kennametal Inc. Common Stock,$25.35,0.79,3.217%,2009488974.00,United States,,1091145,Industrials,Industrial Machinery/Components
KMX,CarMax Inc,$70.34,1.11,1.603%,11070640970.00,United States,,1673752,Consumer Discretionary,Retail-Auto Dealers and Gas Stations
KN,Knowles Corporation Common Stock,$17.08,0.02,0.117%,1532833413.00,United States,2014,450168,Consumer Staples,Consumer Electronics/Appliances
KNF,Knife Riv Holding Co. Common Stock,$76.16,-2.72,-3.448%,4309011401.00,United States,2023,344311,Industrials,Mining & Quarrying of Nonmetallic Minerals (No Fuels)
KNOP,KNOT Offshore Partners LP Common Units representing Limited Partner Interests,$5.27,0.04,0.765%,179417577.00,United Kingdom,2013,24018,Consumer Discretionary,Marine Transportation
KNSL,Kinsale Capital Group Inc. Common Stock,$386.07,-10.22,-2.579%,8986327083.00,United States,,198752,Finance,Property-Casualty Insurers
KNTK,Kinetik Holdings Inc. Class A Common Stock,$39.37,0.16,0.408%,5952986283.00,United States,2022,549419,Energy,Oil & Gas Production
KNX,Knight-Swift Transportation Holdings Inc.,$48.32,0.26,0.541%,7809043520.00,United States,2017,2099660,Industrials,Trucking Freight/Courier Services
KO,Coca-Cola Company (The) Common Stock,$62.85,0.23,0.367%,270754991045.00,United States,,10482360,Consumer Staples,Beverages (Production/Distribution)
KODK,Eastman Kodak Company Common New,$4.66,0.06,1.304%,372334000.00,United States,,445975,Consumer Discretionary,Business Services
KOF,Coca Cola Femsa S.A.B. de C.V.  American Depositary Shares each representing 10 Units (each Unit consists of 3 Series B Shares and 5 Series L Shares),$99.54,0.12,0.121%,20911684316.00,Mexico,1993,136554,Consumer Staples,Beverages (Production/Distribution)
KOP,Koppers Holdings Inc. Common Stock,$44.62,0.22,0.495%,945952210.00,United States,2006,190649,Basic Materials,Forest Products
KORE,KORE Group Holdings Inc. Common Stock,$0.77,-0.015,-1.911%,64061568.00,United States,,22355,Telecommunications,Telecommunications Equipment
KOS,Kosmos Energy Ltd. Common Shares (DE),$6.01,0.02,0.334%,2833730283.00,Bermuda,2011,5050795,Energy,Oil & Gas Production
KR,Kroger Company (The) Common Stock,$55.38,0.07,0.127%,39967072801.00,United States,,4672463,Consumer Staples,Food Chains
KRC,Kilroy Realty Corporation Common Stock,$33.43,-0.51,-1.503%,3923624275.00,United States,1997,777505,Real Estate,Real Estate Investment Trusts
KREF,KKR Real Estate Finance Trust Inc. Common Stock,$9.54,-0.09,-0.935%,661254224.00,United States,2017,458763,Real Estate,Real Estate Investment Trusts
KREF^A,KKR Real Estate Finance Trust Inc. 6.50% Series A Cumulative Redeemable Preferred Stock,$18.93,0.08,0.424%,,United States,,9563,,
KRG,Kite Realty Group Trust Common Stock,$21.22,-0.35,-1.623%,4656695663.00,United States,2004,1059925,Real Estate,Real Estate Investment Trusts
KRO,Kronos Worldwide Inc Common Stock,$12.35,0.15,1.23%,1420583648.00,United States,,161402,Industrials,Major Chemicals
KRP,Kimbell Royalty Partners Common Units Representing Limited Partner Interests,$16.40,-0.14,-0.846%,1566097844.00,United States,2017,469837,Energy,Oil & Gas Production
KSM,DWS Strategic Municipal Income Trust,$9.60,0.003,0.031%,0.00,United States,1989,63119,Finance,Trusts Except Educational Religious and Charitable
KSS,Kohl's Corporation Common Stock,$23.94,-0.11,-0.457%,2655108241.00,United States,1992,3757348,Consumer Discretionary,Department/Specialty Retail Stores
KT,KT Corporation Common Stock,$13.07,0.03,0.23%,6441246851.00,South Korea,,511348,Telecommunications,Telecommunications Equipment
KTB,Kontoor Brands Inc. Common Stock ,$67.21,-0.52,-0.768%,3752312726.00,United States,2019,375851,Consumer Discretionary,Apparel
KTF,DWS Municipal Income Trust,$9.49,0.06,0.636%,374863902.00,United States,1988,103690,Finance,Finance Companies
KTH,Structures Products Cp 8% CorTS Issued by Peco Energy Cap Tr II Preferred Stock,$28.05,-0.03,-0.107%,0.00,United States,,184,Finance,Finance: Consumer Services
KTN,Structured Products Corp 8.205% CorTS 8.205% Corporate Backed Trust Securities (CorTS),$27.16,0.02,0.074%,0.00,United States,,3383,Finance,Finance: Consumer Services
KUKE,Kuke Music Holding Limited American Depositary Shares each representing one Ordinary Share,$2.70,-0.14,-4.93%,58821188.00,,2021,19921,Real Estate,Other Consumer Services
KVUE,Kenvue Inc. Common Stock,$20.45,0.37,1.843%,39153198853.00,United States,2023,23712496,Consumer Discretionary,Specialty Chemicals
KVYO,Klaviyo Inc. Series A Common Stock,$21.53,-1.85,-7.913%,5624379409.00,United States,2023,3645154,Technology,Computer Software: Prepackaged Software
KW,Kennedy-Wilson Holdings Inc. Common Stock,$8.95,0.07,0.788%,1243850397.00,United States,,839941,Finance,Real Estate
KWR,Quaker Houghton Common Stock,$189.81,2.63,1.405%,3414661401.00,United States,,66108,Industrials,Major Chemicals
KYN,Kayne Anderson Energy Infrastructure Fund Inc.,$9.86,0.09,0.921%,1342256886.00,United States,2004,701121,Finance,Finance/Investors Services
L,Loews Corporation Common Stock,$77.31,-0.50,-0.643%,17178370056.00,United States,,683273,Finance,Property-Casualty Insurers
LAAC,Lithium Americas (Argentina) Corp. Common Shares,$5.28,-0.11,-2.041%,844367040.00,Canada,2023,730562,,
LAC,Lithium Americas Corp. Common Shares,$4.32,-0.22,-4.846%,694656000.00,Canada,2023,3943713,Basic Materials,Metal Mining
LAD,Lithia Motors Inc. Common Stock,$260.00,-3.50,-1.328%,7125686360.00,United States,,188983,Consumer Discretionary,Other Specialty Stores
LADR,Ladder Capital Corp Class A Common Stock,$11.11,0.10,0.908%,1420839846.00,United States,2014,280494,Real Estate,Real Estate Investment Trusts
LANV,Lanvin Group Holdings Limited Ordinary Shares,$1.61,-0.102,-5.958%,210863423.00,Cayman Islands,2022,695,Finance,Blank Checks
LAW,CS Disco Inc. Common Stock,$7.98,0.09,1.141%,487269717.00,United States,2021,294690,Technology,Computer Software: Prepackaged Software
LAZ,Lazard Inc. Common Stock,$38.98,0.15,0.386%,4395622227.00,Bermuda,2005,500301,Finance,Investment Managers
LBRT,Liberty Energy Inc. Class A common stock,$21.80,-0.27,-1.223%,3633006907.00,United States,2018,1686909,Energy,Oilfield Services/Equipment
LC,LendingClub Corporation Common Stock,$9.17,0.18,2.002%,1018974206.00,United States,2014,1660236,Finance,Finance: Consumer Services
LCII,LCI Industries,$111.20,6.21,5.915%,2816422670.00,United States,1995,399308,Consumer Discretionary,Auto Parts:O.E.M.
LCW,Learn CW Investment Corporation Class A Ordinary Shares,$10.96,0.00,0.00%,0.00,,2021,15268,Finance,Blank Checks
LDI,loanDepot Inc. Class A Common Stock,$2.15,-0.13,-5.702%,694640174.00,United States,2021,382224,Finance,Finance: Consumer Services
LDOS,Leidos Holdings Inc. Common Stock,$145.50,2.65,1.855%,19673278343.00,United States,,1221568,Technology,EDP Services
LDP,Cohen & Steers Limited Duration Preferred and Income Fund Inc.,$19.59,-0.31,-1.558%,0.00,United States,2012,140785,Finance,Finance Companies
LEA,Lear Corporation Common Stock,$129.18,1.15,0.898%,7335847229.00,United States,,444089,Consumer Discretionary,Auto Parts:O.E.M.
LEG,Leggett & Platt Incorporated Common Stock,$13.03,-0.14,-1.063%,1742503060.00,United States,,2310770,Consumer Discretionary,Home Furnishings
LEN,Lennar Corporation Class A Common Stock,$158.47,-2.63,-1.633%,44109106013.00,United States,,1380184,Consumer Discretionary,Homebuilding
LEO,BNY Mellon Strategic Municipals Inc. Common Stock,$6.07,0.02,0.331%,378105484.00,United States,1987,147740,Finance,Trusts Except Educational Religious and Charitable
LEV,The Lion Electric Company Common Shares,$0.968,-0.072,-6.923%,218977004.00,Canada,2021,1139932,,
LEVI,Levi Strauss & Co Class A Common Stock,$21.98,-0.27,-1.213%,8748682519.00,United States,2019,1569311,Consumer Discretionary,Apparel
LFT,Lument Finance Trust Inc. Common Stock,$2.30,-0.04,-1.709%,120171851.00,United States,2013,73982,Real Estate,Real Estate Investment Trusts
LFT^A,Lument Finance Trust Inc. 7.875% Series A Cumulative Redeemable Preferred Stock,$20.10,0.0925,0.462%,,United States,,7662,,
LGI,Lazard Global Total Return and Income Fund Common Stock,$16.05,-0.04,-0.249%,0.00,United States,2004,19930,,
LH,Laboratory Corporation of America Holdings Common Stock,$201.61,0.11,0.055%,16994438341.00,United States,,556886,Health Care,Medical Specialities
LHX,L3Harris Technologies Inc. Common Stock,$215.81,-0.10,-0.046%,40934917197.00,United States,,994020,Industrials,Industrial Machinery/Components
LICY,Li-Cycle Holdings Corp. Common Shares,$0.7011,0.0421,6.388%,125529934.00,Canada,2021,2231569,,
LII,Lennox International Inc. Common Stock,$480.66,9.46,2.008%,17123250060.00,United States,1999,222873,Industrials,Industrial Machinery/Components
LITB,LightInTheBox Holding Co. Ltd. American Depositary Shares each representing 2 ordinary shares,$0.7226,0.0004,0.055%,80660434.00,China,2013,26420,Consumer Discretionary,Catalog/Specialty Distribution
LL,LL Flooring Holdings Inc. Common Stock,$1.53,-0.07,-4.375%,47183748.00,United States,2007,326193,Consumer Discretionary,RETAIL: Building Materials
LLAP,Terran Orbital Corporation Common Stock,$1.02,-0.03,-2.857%,205296215.00,United States,2021,1987182,Industrials,Military/Government/Technical
LLY,Eli Lilly and Company Common Stock,$775.00,-2.77,-0.356%,736564174150.00,United States,,2089618,Health Care,Biotechnology: Pharmaceutical Preparations
LMND,Lemonade Inc. Common Stock,$16.70,-0.78,-4.462%,1177376353.00,United States,2020,1518206,Finance,Property-Casualty Insurers
LMT,Lockheed Martin Corporation Common Stock,$466.16,-0.52,-0.111%,111849565207.00,United States,,598988,Industrials,Military/Government/Technical
LNC,Lincoln National Corporation Common Stock,$29.29,0.15,0.515%,4980085499.00,United States,,1593108,Finance,Life Insurance
LNC^D,Lincoln National Corporation Depositary Shares Each Representing a 1/1000th Interest in a Share of 9.000% Non-Cumulative Preferred Stock Series D,$28.43,-0.25,-0.872%,,United States,,38042,,
LND,Brasilagro Brazilian Agric Real Estate Co Sponsored ADR (Brazil),$5.09,0.05,0.992%,521098971.00,Brazil,,37910,Consumer Staples,Farming/Seeds/Milling
LNG,Cheniere Energy Inc. Common Stock,$157.13,0.82,0.525%,35969021282.00,United States,2001,1240382,Utilities,Oil/Gas Transmission
LNN,Lindsay Corporation Common Stock,$118.35,-0.43,-0.362%,1306379965.00,United States,,75424,Industrials,Industrial Machinery/Components
LOAR,Loar Holdings Inc. Common Stock,$48.68,-1.15,-2.308%,4283840000.00,,2024,120403,Industrials,Military/Government/Technical
LOB,Live Oak Bancshares Inc. Common Stock,$34.52,-0.73,-2.071%,1545434130.00,United States,2022,122691,Finance,Major Banks
LOCL,Local Bounti Corporation Common Stock,$2.96,0.08,2.778%,24975124.00,,2021,6746,Consumer Staples,Farming/Seeds/Milling
LOMA,Loma Negra Compania Industrial Argentina Sociedad Anonima ADS,$7.48,-0.01,-0.134%,872890792.00,Argentina,2017,822598,Industrials,Building Materials
LOW,Lowe's Companies Inc. Common Stock,$232.07,0.61,0.264%,132786797273.00,United States,,1689170,Consumer Discretionary,RETAIL: Building Materials
LPG,Dorian LPG Ltd. Common Stock,$43.77,1.50,3.549%,1776759068.00,United States,2014,826844,Consumer Discretionary,Marine Transportation
LPL,LG Display Co Ltd AMERICAN DEPOSITORY SHARES,$4.00,0.01,0.251%,4000000000.00,South Korea,2004,187325,Technology,Industrial Machinery/Components
LPX,Louisiana-Pacific Corporation Common Stock,$88.14,15.17,20.789%,6368258051.00,United States,,3970968,Basic Materials,Forest Products
LRN,Stride Inc. Common Stock,$72.77,0.66,0.915%,3147661838.00,United States,,1018446,Real Estate,Other Consumer Services
LSPD,Lightspeed Commerce Inc. Subordinate Voting Shares,$13.57,-0.27,-1.951%,2079442632.00,Canada,,816224,Technology,Computer Software: Prepackaged Software
LTC,LTC Properties Inc. Common Stock,$33.64,0.06,0.179%,1462512086.00,United States,,127875,Real Estate,Real Estate Investment Trusts
LTH,Life Time Group Holdings Inc. Common Stock,$14.64,-0.45,-2.982%,2879767686.00,United States,2021,699234,Consumer Discretionary,Hotels/Resorts
LU,Lufax Holding Ltd American Depositary Shares each representing two (2) Ordinary Shares,$4.50,-0.26,-5.462%,2579218137.00,China,,3213915,Finance,Finance: Consumer Services
LUMN,Lumen Technologies Inc. Common Stock,$1.28,-0.02,-1.538%,1299245787.00,United States,,6885280,Telecommunications,Telecommunications Equipment
LUV,Southwest Airlines Company Common Stock,$27.18,0.18,0.667%,16266046556.00,United States,,6453407,Consumer Discretionary,Air Freight/Delivery Services
LVS,Las Vegas Sands Corp. Common Stock,$46.77,0.05,0.107%,34845855206.00,United States,2004,3438718,Consumer Discretionary,Hotels/Resorts
LVWR,LiveWire Group Inc. Common Stock,$6.74,-0.10,-1.462%,1369315688.00,United States,2022,14083,Consumer Discretionary,Motor Vehicles
LW,Lamb Weston Holdings Inc. Common Stock ,$83.16,-1.94,-2.28%,12007557306.00,United States,2016,1740013,Consumer Staples,Packaged Foods
LXP,LXP Industrial Trust Common Stock (Maryland REIT),$8.64,-0.13,-1.482%,2542877764.00,United States,,1766526,Real Estate,Real Estate Investment Trusts
LXP^C,LXP Industrial Trust 6.5% Series C Cumulative Convertible Preferred Stock,$45.2442,0.2342,0.52%,,United States,,1890,,
LXU,LSB Industries Inc. Common Stock,$8.57,-0.10,-1.153%,613129672.00,United States,2003,221481,Industrials,Major Chemicals
LYB,LyondellBasell Industries NV Ordinary Shares Class A (Netherlands),$102.18,0.73,0.72%,33272082527.00,Netherlands,,3123179,Industrials,Major Chemicals
LYG,Lloyds Banking Group Plc American Depositary Shares,$2.67,0.02,0.755%,169729832518.00,United Kingdom,,2905645,Finance,Commercial Banks
LYV,Live Nation Entertainment Inc. Common Stock,$95.79,-0.55,-0.571%,22169883589.00,United States,,1319172,Consumer Discretionary,Services-Misc. Amusement & Recreation
LZB,La-Z-Boy Incorporated Common Stock,$34.33,0.35,1.03%,1463825501.00,United States,,353213,Consumer Discretionary,Home Furnishings
LZM,Lifezone Metals Limited Ordinary Shares,$6.73,-0.18,-2.605%,526756777.00,Isle of Man,,59092,Basic Materials,Metal Mining
M,Macy's Inc Common Stock,$19.06,-0.34,-1.753%,5227615476.00,United States,,3159004,Consumer Discretionary,Department/Specialty Retail Stores
MA,Mastercard Incorporated Common Stock,$454.77,1.71,0.377%,422761195458.00,United States,2006,2332387,Consumer Discretionary,Business Services
MAA,Mid-America Apartment Communities Inc. Common Stock,$132.99,-3.20,-2.35%,15536690538.00,United States,1994,676490,Real Estate,Real Estate Investment Trusts
MAA^I,Mid-America Apartment Communities Inc. 8.50% Series I Cumulative Redeemable Preferred Stock,$54.61,-1.39,-2.482%,,United States,,489,,
MAC,Macerich Company (The) Common Stock,$15.84,0.59,3.869%,3417006273.00,United States,1994,4300174,Real Estate,Real Estate Investment Trusts
MAIN,Main Street Capital Corporation Common Stock,$50.63,-0.07,-0.138%,4302544741.00,United States,2007,287336,Finance,Finance/Investors Services
MAN,ManpowerGroup Common Stock,$76.92,-0.12,-0.156%,3669336682.00,United States,,193412,Consumer Discretionary,Professional Services
MANU,Manchester United Ltd. Class A Ordinary Shares,$15.48,-0.39,-2.457%,2550252182.00,United Kingdom,2012,424729,Consumer Discretionary,Services-Misc. Amusement & Recreation
MAS,Masco Corporation Common Stock,$70.67,-0.01,-0.014%,15564670335.00,United States,,1106926,Consumer Discretionary,Building Products
MATV,Mativ Holdings Inc. Common Stock,$18.53,0.39,2.15%,1006181075.00,United States,,361737,Basic Materials,Paper
MATX,Matson Inc. Common Stock,$111.83,-0.20,-0.179%,3821024550.00,United States,,210152,Consumer Discretionary,Marine Transportation
MAV,Pioneer Municipal High Income Advantage Fund Inc.,$8.095,0.055,0.684%,0.00,United States,,51471,Finance,Finance Companies
MAX,MediaAlpha Inc. Class A Common Stock,$19.99,-2.19,-9.874%,1316203629.00,United States,2020,4535387,Consumer Discretionary,Business Services
MBC,MasterBrand Inc. Common Stock,$16.40,-1.08,-6.178%,2082844739.00,United States,2022,1295614,Consumer Discretionary,Home Furnishings
MBI,MBIA Inc. Common Stock,$6.78,0.13,1.955%,345277677.00,United States,1987,306276,Finance,Property-Casualty Insurers
MC,Moelis & Company Class A Common Stock,$52.93,0.90,1.73%,3958472787.00,United States,2014,470490,Finance,Investment Bankers/Brokers/Service
MCB,Metropolitan Bank Holding Corp. Common Stock,$41.92,-0.32,-0.758%,469207877.00,United States,2017,64615,Finance,Major Banks
MCD,McDonald's Corporation Common Stock,$268.49,0.99,0.37%,193863604013.00,United States,,3258807,Consumer Discretionary,Restaurants
MCI,Barings Corporate Investors Common Stock,$18.49,-0.20,-1.07%,374639184.00,United States,,24351,Finance,Trusts Except Educational Religious and Charitable
MCK,McKesson Corporation Common Stock,$543.61,-2.14,-0.392%,71434858352.00,United States,,1378610,Health Care,Other Pharmaceuticals
MCN,Madison Covered Call & Equity Strategy Fund Common Stock,$7.1799,-0.0001,-0.001%,0.00,United States,2004,31749,,
MCO,Moody's Corporation Common Stock,$395.94,1.97,0.50%,72298644000.00,United States,,550798,Finance,Finance: Consumer Services
MCR,MFS Charter Income Trust Common Stock,$6.31,0.025,0.398%,277692878.00,United States,1989,32808,Finance,Trusts Except Educational Religious and Charitable
MCS,Marcus Corporation (The) Common Stock,$11.17,-0.07,-0.623%,359170981.00,United States,,892499,Consumer Discretionary,Movies/Entertainment
MCW,Mister Car Wash Inc. Common Stock,$7.77,0.02,0.258%,2482586352.00,United States,2021,1245595,Consumer Discretionary,Automotive Aftermarket
MCY,Mercury General Corporation Common Stock,$56.86,1.31,2.358%,3148402281.00,United States,,246250,Finance,Property-Casualty Insurers
MD,Pediatrix Medical Group Inc. Common Stock,$8.50,-0.55,-6.077%,715045322.00,United States,,1100368,Health Care,Hospital/Nursing Management
MDT,Medtronic plc. Ordinary Shares,$81.55,-0.35,-0.427%,108283928055.00,United States,,4175552,Health Care,Biotechnology: Electromedical & Electrotherapeutic Apparatus
MDU,MDU Resources Group Inc. Common Stock (Holding Company),$25.41,0.01,0.039%,5180800102.00,United States,,816823,Industrials,Mining & Quarrying of Nonmetallic Minerals (No Fuels)
MDV,Modiv Industrial Inc. Class C Common Stock,$14.87,0.05,0.337%,140566184.00,,2022,41513,Real Estate,Real Estate Investment Trusts
MDV^A,Modiv Industrial Inc. 7.375% Series A Cumulative Redeemable Perpetual Preferred Stock,$23.88,0.00,0.00%,,,,80,,
MEC,Mayville Engineering Company Inc. Common Stock,$15.00,1.38,10.132%,305473605.00,United States,2019,230601,Industrials,Industrial Specialties
MED,MEDIFAST INC Common Stock,$24.96,-0.55,-2.156%,272993635.00,United States,,336888,Consumer Staples,Packaged Foods
MEG,Montrose Environmental Group Inc. Common Stock,$43.27,-4.30,-9.039%,1314571764.00,United States,2020,797547,Consumer Discretionary,Professional Services
MEGI,MainStay CBRE Global Infrastructure Megatrends Term Fund Common Shares,$12.96,0.10,0.778%,0.00,United States,2021,99237,Finance,Investment Managers
MEI,Methode Electronics Inc. Common Stock,$11.42,0.06,0.528%,404159510.00,United States,,587087,Technology,Electrical Products
MER^K,Bank of America Corporation Income Capital Obligation Notes initially due December 15 2066,$25.31,-0.06,-0.236%,,United States,,21706,,
MET,MetLife Inc. Common Stock,$71.66,0.40,0.561%,50959103632.00,United States,2000,2549530,Finance,Life Insurance
MET^A,MetLife Inc. Preferred Series A Floating Rate,$24.42,-0.04,-0.164%,,United States,,32425,,
MET^E,MetLife Inc. Depositary shares each representing a 1/1000th interest in a share of the Issuera??s 5.625% Non-Cumulative Preferred Stock Series E.,$23.965,-0.135,-0.56%,,United States,,86605,,
MET^F,MetLife Inc. Depositary Shares each representing a 1/1000th interest in a share of 4.75% Non-Cumulative Preferred Stock Series F,$20.84,-0.14,-0.667%,,United States,,57496,,
MFA,MFA Financial Inc.,$10.71,0.06,0.563%,1093303564.00,United States,,649590,Real Estate,Real Estate Investment Trusts
MFA^B,MFA Financial Inc. Preferred Series B,$20.41,-0.24,-1.162%,,United States,,12949,,
MFA^C,MFA Financial Inc. 6.50% Series C Fixed-to-Floating Rate Cumulative Redeemable Preferred Stock,$23.11,0.1101,0.479%,,United States,,21393,,
MFAN,MFA Financial Inc. 8.875% Senior Notes due 2029,$25.22,0.02,0.079%,2574520625.00,United States,2024,4838,,
MFAO,MFA Financial Inc. 9.000% Senior Notes due 2029,$25.2499,-0.0501,-0.198%,2577572892.00,United States,2024,36174,,
MFC,Manulife Financial Corporation Common Stock,$24.47,0.23,0.949%,44195707949.00,Canada,,2314370,Finance,Life Insurance
MFD,Macquarie First Trust Global Common Stock,$7.56,0.035,0.465%,64618662.00,United States,2004,11092,Finance,Trusts Except Educational Religious and Charitable
MFG,Mizuho Financial Group Inc. Sponosred ADR (Japan),$3.90,0.00,0.00%,49502017344.00,Japan,,688183,Finance,Major Banks
MFM,MFS Municipal Income Trust Common Stock,$5.31,0.09,1.724%,218706321.00,United States,1986,95633,Finance,Finance Companies
MG,Mistras Group Inc Common Stock,$9.07,0.27,3.068%,280870445.00,United States,2009,75950,Consumer Discretionary,Military/Government/Technical
MGA,Magna International Inc. Common Stock,$47.08,0.48,1.03%,13505668982.00,Canada,,1003411,Consumer Discretionary,Auto Parts:O.E.M.
MGF,MFS Government Markets Income Trust Common Stock,$3.13,-0.03,-0.949%,102029840.00,United States,1987,50216,Finance,Trusts Except Educational Religious and Charitable
MGM,MGM Resorts International Common Stock,$40.04,-0.60,-1.476%,12559764617.00,United States,,4428022,Consumer Discretionary,Hotels/Resorts
MGR,Affiliated Managers Group Inc. 5.875% Junior Subordinated Notes due 2059,$22.702,-0.168,-0.735%,744492271.00,United States,2019,14727,Finance,Investment Managers
MGRB,Affiliated Managers Group Inc. 4.750% Junior Subordinated Notes due 2060,$18.92,-0.22,-1.149%,620464883.00,United States,2020,25750,Finance,Investment Managers
MGRD,Affiliated Managers Group Inc. 4.200% Junior Subordinated Notes due 2061,$16.88,-0.15,-0.881%,553564864.00,United States,2021,4709,Finance,Investment Managers
MGRE,Affiliated Managers Group Inc. 6.750% Junior Subordinated Notes due 2064,$25.60,-0.08,-0.312%,,United States,2024,16775,,
MGY,Magnolia Oil & Gas Corporation Class A Common Stock,$25.88,0.08,0.31%,5286687492.00,United States,2017,4258198,Energy,Oil & Gas Production
MHD,Blackrock MuniHoldings Fund Inc. Common Stock,$11.86,-0.01,-0.084%,1764322906.00,United States,1997,211884,Finance,Investment Bankers/Brokers/Service
MHF,Western Asset Municipal High Income Fund Inc. Common Stock,$6.82,0.00,0.00%,0.00,United States,1988,96532,Finance,Finance/Investors Services
MHI,Pioneer Municipal High Income Fund Inc.,$8.86,0.06,0.682%,0.00,United States,2003,74017,Finance,Investment Managers
MHK,Mohawk Industries Inc. Common Stock,$118.22,0.11,0.093%,7549893909.00,United States,,497443,Consumer Discretionary,Home Furnishings
MHLA,Maiden Holdings Ltd. 6.625% Notes due 2046,$15.33,-0.12,-0.777%,1540237600.00,Bermuda,2016,2790,Finance,Property-Casualty Insurers
MHN,Blackrock MuniHoldings New York Quality Fund Inc. Common Stock,$10.63,0.01,0.094%,1581345067.00,United States,1997,19559,Finance,Investment Bankers/Brokers/Service
MHNC,Maiden Holdings North America Ltd. 7.75% Notes due 2043,$17.78,0.00,0.00%,1786394294.00,Bermuda,2013,9830,Finance,Property-Casualty Insurers
MHO,M/I Homes Inc. Common Stock,$122.55,-0.33,-0.269%,3400965688.00,United States,1993,174233,Consumer Discretionary,Homebuilding
MIN,MFS Intermediate Income Trust Common Stock,$2.645,-0.005,-0.189%,303904604.00,United States,1988,48240,Finance,Trusts Except Educational Religious and Charitable
MIO,Pioneer Municipal High Income Opportunities Fund Inc. Common Stock,$11.38,0.13,1.156%,0.00,,2021,49973,Finance,Investment Managers
MIR,Mirion Technologies Inc. Class A Common Stock,$10.10,-0.01,-0.099%,2296427213.00,United States,2020,668492,Industrials,Industrial Machinery/Components
MITN,AG Mortgage Investment Trust Inc. 9.500% Senior Notes due 2029,$25.15,-0.09,-0.357%,740733343.00,United States,2024,13696,,
MITT,AG Mortgage Investment Trust Inc. Common Stock,$6.75,-0.05,-0.735%,198805172.00,United States,2011,232707,Real Estate,Real Estate Investment Trusts
MITT^A,AG Mortgage Investment Trust Inc. 8.25% Preferred Series A,$19.9499,0.00,0.00%,,United States,,1268,,
MITT^B,AG Mortgage Investment Trust Inc. Preferred Series B,$19.10,-0.10,-0.521%,,United States,,8649,,
MITT^C,AG Mortgage Investment Trust Inc. 8.00% Series C Fixed-to-Floating Rate Cumulative Redeemable Preferred Stock $0.01 par value per share,$24.27,0.08,0.331%,,United States,,37458,,
MIY,Blackrock MuniYield Michigan Quality Fund Inc. Common Stock,$11.37,0.07,0.619%,1691429295.00,United States,1992,12557,Finance,Investment Bankers/Brokers/Service
MKC,McCormick & Company Incorporated Common Stock,$75.56,-0.62,-0.814%,20281263990.00,United States,,1331092,Consumer Staples,Packaged Foods
MKFG,Markforged Holding Corporation Common Stock,$0.6102,0.0234,3.988%,121644163.00,United States,2020,215834,Technology,Computer peripheral equipment
MKL,Markel Group Inc. Common Stock,$1615.83,0.68,0.042%,21010065486.00,United States,1986,33832,Finance,Property-Casualty Insurers
