Symbol,Name,Last Sale,Net Change,% Change,Market Cap,Country,IPO Year,Volume,Sector,Industry
DDL,Dingdong (Cayman) Limited American Depositary Shares (each two representing three Ordinary Shares),$1.67,0.05,3.086%,197250118.00,Cayman Islands,2021,505587,Consumer Discretionary,Catalog/Specialty Distribution
DDS,Dillard's Inc. Common Stock,$423.47,-10.96,-2.523%,6872951131.00,United States,,104691,Consumer Discretionary,Department/Specialty Retail Stores
DDT,Dillard's Capital Trust I,$25.89,-0.10,-0.385%,420196719.00,United States,,4377,Consumer Discretionary,Department/Specialty Retail Stores
DE,Deere & Company Common Stock,$405.42,-0.15,-0.037%,112851985498.00,United States,,640299,Industrials,Industrial Machinery/Components
DEA,Easterly Government Properties Inc. Common Stock,$11.72,-0.24,-2.007%,1207148034.00,United States,2015,739825,Real Estate,Real Estate Investment Trusts
DEC,Diversified Energy Company plc Ordinary Shares,$14.10,-0.03,-0.212%,670186099.00,,,60940,,
DECK,Deckers Outdoor Corporation Common Stock,$853.48,-8.90,-1.032%,21907312406.00,United States,1993,280724,Consumer Discretionary,Shoe Manufacturing
DEI,Douglas Emmett Inc. Common Stock,$13.93,0.19,1.383%,2331212246.00,United States,2006,2808486,Real Estate,Real Estate Investment Trusts
DELL,Dell Technologies Inc. Class C Common Stock ,$131.61,4.06,3.183%,93941945989.00,United States,2018,4917432,Technology,Computer Manufacturing
DEO,Diageo plc Common Stock,$140.91,1.87,1.345%,78694878242.00,United Kingdom,,729571,Consumer Staples,Beverages (Production/Distribution)
DESP,Despegar.com Corp. Ordinary Shares,$12.83,-0.12,-0.927%,924455501.00,Argentina,2017,957815,Consumer Discretionary,Transportation Services
DFH,Dream Finders Homes Inc. Class A Common Stock,$29.88,-0.88,-2.861%,2800599512.00,United States,2022,459622,Consumer Discretionary,Homebuilding
DFIN,Donnelley Financial Solutions Inc. Common Stock ,$62.71,-0.18,-0.286%,1838398459.00,United States,2016,279561,Consumer Discretionary,Other Consumer Services
DFP,Flaherty & Crumrine Dynamic Preferred and Income Fund Inc. Common Stock,$18.67,-0.05,-0.267%,0.00,,2013,61627,Finance,Investment Managers
DFS,Discover Financial Services Common Stock,$123.57,-0.04,-0.032%,30966523002.00,United States,,519539,Finance,Finance: Consumer Services
DG,Dollar General Corporation Common Stock,$137.52,-2.38,-1.701%,30209199376.00,United States,2009,1700355,Consumer Discretionary,Department/Specialty Retail Stores
DGX,Quest Diagnostics Incorporated Common Stock,$136.14,-0.80,-0.584%,15124006884.00,United States,,612350,Health Care,Medical Specialities
DHF,BNY Mellon High Yield Strategies Fund Common Stock,$2.36,-0.005,-0.211%,0.00,United States,1998,126136,Finance,Finance Companies
DHI,D.R. Horton Inc. Common Stock,$147.74,-3.66,-2.417%,48652591520.00,United States,,2849915,Consumer Discretionary,Homebuilding
DHR,Danaher Corporation Common Stock,$249.55,0.79,0.318%,184838326307.00,United States,,1471344,Industrials,Industrial Machinery/Components
DHT,DHT Holdings Inc.,$12.06,0.42,3.608%,1941654477.00,Jersey,2005,2264952,Consumer Discretionary,Marine Transportation
DHX,DHI Group Inc. Common Stock,$2.75,-0.08,-2.827%,132089339.00,United States,2007,127044,Consumer Discretionary,Business Services
DIAX,Nuveen Dow 30SM Dynamic Overwrite Fund Common Shares of Beneficial Interest,$14.14,0.07,0.498%,0.00,,2014,37974,Finance,Finance Companies
DIN,Dine Brands Global Inc. Common Stock,$43.56,-0.02,-0.046%,664418284.00,United States,,602365,Consumer Discretionary,Restaurants
DINO,HF Sinclair Corporation Common Stock,$56.95,2.10,3.829%,11308470266.00,United States,1960,3427526,Energy,Oil & Gas Production
DIS,Walt Disney Company (The) Common Stock,$105.44,0.05,0.047%,193408827658.00,United States,,15201733,Consumer Discretionary,Movies/Entertainment
DK,Delek US Holdings Inc. Common Stock,$27.84,-0.08,-0.287%,1782296393.00,United States,2017,1817260,Energy,Integrated oil Companies
DKL,Delek Logistics Partners L.P. Common Units representing Limited Partner Interests,$39.09,0.26,0.67%,1704981142.00,United States,2012,66651,Energy,Natural Gas Distribution
DKS,Dick's Sporting Goods Inc Common Stock,$196.15,-6.53,-3.222%,16172240910.00,United States,2002,1445630,Consumer Discretionary,Other Specialty Stores
DLB,Dolby Laboratories Common Stock,$82.63,-0.31,-0.374%,7918881911.00,United States,2005,240389,Miscellaneous,Multi-Sector Companies
DLNG,Dynagas LNG Partners LP Common Units,$4.00,0.04,1.01%,147351092.00,Greece,,49416,Consumer Discretionary,Marine Transportation
DLNG^A,Dynagas LNG Partners LP 9.00% Series A Cumulative Redeemable Preferred Units,$25.60,0.15,0.589%,,Greece,,676,,
DLNG^B,Dynagas LNG Partners LP 8.75% Series B Fixed to Floating Rate Cumulative Redeemable Perpetual Preferred Units liquidation preference $25.00 per Uni,$26.1501,-0.4499,-1.691%,,Greece,,10191,,
DLR,Digital Realty Trust Inc. Common Stock,$140.25,-4.38,-3.028%,43817832614.00,United States,2004,6517854,Real Estate,Real Estate Investment Trusts
DLR^J,Digital Realty Trust Inc. 5.250% Series J Cumulative Redeemable Preferred Stock,$21.5095,-0.4205,-1.917%,,United States,,6659,,
DLR^K,Digital Realty Trust Inc. 5.850% Series K Cumulative Redeemable Preferred Stock par value $0.01 per share,$23.21,-0.08,-0.343%,,United States,,34769,,
DLR^L,Digital Realty Trust Inc. 5.200% Series L Cumulative Redeemable Preferred Stock,$21.79,0.03,0.138%,,United States,,18568,,
DLX,Deluxe Corporation Common Stock,$22.16,0.00,0.00%,976055726.00,United States,,140543,Consumer Discretionary,Publishing
DLY,DoubleLine Yield Opportunities Fund Common Shares of Beneficial Interest,$15.97,0.08,0.503%,765694091.00,United States,2020,197864,Finance,Investment Managers
DM,Desktop Metal Inc. Class A Common Stock,$0.8401,0.0051,0.611%,276927635.00,United States,2019,1230595,Technology,Computer peripheral equipment
DMA,Destra Multi-Alternative Fund Common Stock,$7.30,0.05,0.69%,0.00,,2022,103186,Finance,Trusts Except Educational Religious and Charitable
DMB,BNY Mellon Municipal Bond Infrastructure Fund Inc. Common Stock,$10.26,0.02,0.195%,0.00,,2013,41286,Finance,Trusts Except Educational Religious and Charitable
DMO,Western Asset Mortgage Opportunity Fund Inc. Common Stock,$11.71,0.135,1.166%,0.00,United States,2010,72779,Finance,Trusts Except Educational Religious and Charitable
DNA,Ginkgo Bioworks Holdings Inc. Class A Common Stock,$0.8934,-0.0406,-4.347%,1922950395.00,United States,2021,44929475,Health Care,Biotechnology: Biological Products (No Diagnostic Substances)
DNB,Dun & Bradstreet Holdings Inc. Common Stock,$10.13,-0.08,-0.784%,4484728397.00,United States,2020,6158973,Finance,Finance: Consumer Services
DNMR,Danimer Scientific Inc. Common Stock,$0.7898,-0.0302,-3.683%,90227479.00,United States,2020,1211682,Industrials,Major Chemicals
DNOW,DNOW Inc. Common Stock,$14.71,0.09,0.616%,1561703272.00,United States,2014,560692,Industrials,Metal Fabrications
DNP,DNP Select Income Fund Inc. Common Stock,$8.85,0.05,0.568%,0.00,United States,1987,550473,Finance,Investment Managers
DO,Diamond Offshore Drilling Inc. Common Stock,$14.66,0.95,6.929%,1502167789.00,United States,2022,3915374,Energy,Oil & Gas Production
DOC,Healthpeak Properties Inc. Common Stock,$19.15,-0.05,-0.26%,13477416031.00,United States,,3328956,Real Estate,Real Estate Investment Trusts
DOCN,DigitalOcean Holdings Inc. Common Stock,$33.67,-1.16,-3.33%,3057124721.00,United States,2021,1785938,Technology,Computer Software: Programming Data Processing
DOCS,Doximity Inc. Class A Common Stock,$23.88,-0.49,-2.011%,4454903550.00,United States,2021,928282,Technology,EDP Services
DOLE,Dole plc Ordinary Shares,$12.49,0.05,0.402%,1185665446.00,Ireland,2021,443517,Consumer Staples,Farming/Seeds/Milling
DOMA,Doma Holdings Inc. Common Stock,$6.07,0.02,0.331%,84298776.00,United States,2021,6214,Finance,Specialty Insurers
DOOR,Masonite International Corporation Ordinary Shares (Canada),$132.62,-0.03,-0.023%,2908681784.00,Canada,,902035,Basic Materials,Forest Products
DOUG,Douglas Elliman Inc. Common Stock,$1.41,0.01,0.714%,129064931.00,United States,2021,694257,Finance,Real Estate
DOV,Dover Corporation Common Stock,$183.75,1.92,1.056%,25252791900.00,United States,,1027425,Industrials,Industrial Machinery/Components
DOW,Dow Inc. Common Stock ,$58.64,0.28,0.48%,41235989871.00,United States,2019,4950640,Industrials,Major Chemicals
DPG,Duff & Phelps Utility and Infrastructure Fund Inc.,$9.82,0.13,1.342%,0.00,United States,2011,117399,Finance,Trusts Except Educational Religious and Charitable
DPZ,Domino's Pizza Inc Common Stock,$516.67,-0.56,-0.108%,18021561717.00,United States,2004,399441,Consumer Discretionary,Food Distributors
DQ,DAQO New Energy Corp. American Depositary Shares each representing five ordinary shares,$18.58,-0.18,-0.959%,1226418440.00,China,2010,1247011,Technology,Semiconductors
DRD,DRDGOLD Limited American Depositary Shares,$8.01,0.07,0.882%,692535557.00,South Africa,,159634,Basic Materials,Precious Metals
DRH,Diamondrock Hospitality Company Common Stock,$8.42,-0.30,-3.44%,1768742526.00,United States,2005,2552571,Real Estate,Real Estate Investment Trusts
DRH^A,Diamondrock Hospitality Company 8.250% Series A Cumulative Redeemable Preferred Stock,$25.3712,0.0174,0.069%,,United States,,11297,,
DRI,Darden Restaurants Inc. Common Stock,$147.98,0.95,0.646%,17662736977.00,United States,,1226021,Consumer Discretionary,Restaurants
DRQ,Dril-Quip Inc. Common Stock,$19.22,0.30,1.586%,661560453.00,United States,1997,254236,Industrials,Metal Fabrications
DSL,DoubleLine Income Solutions Fund Common Shares of Beneficial Interests,$12.60,0.03,0.239%,1285160033.00,United States,2013,541505,Finance,Trusts Except Educational Religious and Charitable
DSM,BNY Mellon Strategic Municipal Bond Fund Inc. Common Stock,$5.78,0.035,0.609%,0.00,United States,1989,104992,Finance,Investment Managers
DSU,Blackrock Debt Strategies Fund Inc. Common Stock,$11.00,0.04,0.365%,0.00,United States,1998,156857,Finance,Finance Companies
DSX,Diana Shipping inc. common stock,$3.12,0.05,1.629%,374284301.00,Greece,2005,662100,Consumer Discretionary,Marine Transportation
DSX^B,Diana Shipping Inc. Perpetual Preferred Shares Series B (Marshall Islands),$26.4727,-0.1273,-0.479%,,Greece,,7832,,
DT,Dynatrace Inc. Common Stock,$46.07,-0.69,-1.476%,13636685263.00,United States,2019,2023404,Technology,EDP Services
DTB,DTE Energy Company 2020 Series G 4.375% Junior Subordinated Debentures due 2080,$19.40,-0.36,-1.822%,4014582534.00,United States,2020,8995,Utilities,Electric Utilities: Central
DTC,Solo Brands Inc. Class A Common Stock,$1.97,0.02,1.026%,179616681.00,United States,2021,776654,Consumer Discretionary,Recreational Games/Products/Toys
DTE,DTE Energy Company Common Stock,$114.73,1.39,1.226%,23741910004.00,United States,,963592,Utilities,Electric Utilities: Central
DTF,DTF Tax-Free Income 2028 Term Fund Inc. Common Stock,$10.93,0.035,0.321%,76833167.00,United States,1991,3638,Finance,Investment Managers
DTG,DTE Energy Company 2021 Series E 4.375% Junior Subordinated Debentures,$19.88,-0.03,-0.151%,4113912411.00,United States,2021,22383,Utilities,Electric Utilities: Central
DTM,DT Midstream Inc. Common Stock ,$64.12,0.06,0.094%,6226635492.00,United States,2021,655800,Utilities,Natural Gas Distribution
DTW,DTE Energy Company 2017 Series E 5.25% Junior Subordinated Debentures due 2077,$23.07,-0.23,-0.987%,4774042219.00,United States,2017,22510,Utilities,Electric Utilities: Central
DUK,Duke Energy Corporation (Holding Company) Common Stock,$102.38,0.12,0.117%,78915675841.00,United States,,3464626,Industrials,Railroads
DUK^A,Duke Energy Corporation Depositary Shares each representing a 1/1000th interest in a share of 5.75% Series A Cumulative Redeemable Perpetual Preferred Stock,$24.91,-0.17,-0.678%,,United States,,80630,,
DUKB,Duke Energy Corporation 5.625% Junior Subordinated Debentures due 2078,$24.19,-0.09,-0.371%,18645928879.00,United States,2018,35461,Utilities,Power Generation
DV,DoubleVerify Holdings Inc. Common Stock,$18.78,-11.79,-38.567%,3216148280.00,United States,2021,20283509,Technology,Computer Software: Programming Data Processing
DVA,DaVita Inc. Common Stock,$135.85,-1.84,-1.336%,11914045000.00,United States,,725127,Health Care,Misc Health and Biotechnology Services
DVN,Devon Energy Corporation Common Stock,$50.56,-0.42,-0.824%,31953920000.00,United States,1985,5145030,Energy,Oil & Gas Production
DX,Dynex Capital Inc. Common Stock,$12.18,0.01,0.082%,781480140.00,United States,,547055,Real Estate,Real Estate Investment Trusts
DX^C,Dynex Capital Inc. 6.900% Series C Fixed-to-Floating Rate Cumulative Redeemable Preferred Stock,$24.582,-0.0198,-0.08%,,United States,,5703,,
DXC,DXC Technology Company Common Stock ,$19.90,0.20,1.015%,3639125855.00,United States,,1232837,Technology,EDP Services
DXYZ,Destiny Tech100 Inc. Common Stock,$14.41,0.64,4.648%,0.00,,2024,996427,,
DY,Dycom Industries Inc. Common Stock,$148.21,0.89,0.604%,4311676411.00,United States,,94165,Industrials,Water Sewer Pipeline Comm & Power Line Construction
E,ENI S.p.A. Common Stock,$31.98,-0.28,-0.868%,53981246925.00,Italy,,216857,Energy,Oil & Gas Production
EAF,GrafTech International Ltd. Common Stock,$1.73,-0.04,-2.26%,444899130.00,United States,2018,977521,Energy,Industrial Machinery/Components
EAI,Entergy Arkansas LLC First Mortgage Bonds 4.875% Series Due September 1 2066,$21.57,-0.21,-0.964%,4605991710.00,United States,2016,19487,Utilities,Electric Utilities: Central
EARN,Ellington Credit Company Common Shares of Beneficial Interest,$7.05,-0.01,-0.142%,139728251.00,United States,2013,188935,Real Estate,Real Estate Investment Trusts
EAT,Brinker International Inc. Common Stock,$57.88,0.92,1.615%,2575111066.00,United States,,1403352,Consumer Discretionary,Restaurants
EB,Eventbrite Inc. Class A Common Stock,$5.45,-0.14,-2.504%,529278243.00,United States,2018,1256187,Technology,Computer Software: Programming Data Processing
EBF,Ennis Inc. Common Stock,$20.59,0.21,1.03%,532760052.00,United States,,71218,Consumer Discretionary,Office Equipment/Supplies/Services
EBR,Centrais Electricas Brasileiras S A American Depositary Shares (Each representing one Common Share),$7.83,-0.06,-0.76%,17584725828.00,Brazil,2016,764981,Utilities,Electric Utilities: Central
EBS,Emergent Biosolutions Inc. Common Stock,$4.41,0.01,0.227%,231092159.00,United States,2006,6575905,Health Care,Biotechnology: Pharmaceutical Preparations
EC,Ecopetrol S.A. American Depositary Shares,$11.74,0.08,0.686%,24135499789.00,Colombia,,1590413,Energy,Oil & Gas Production
ECAT,BlackRock ESG Capital Allocation Term Trust Common Shares of Beneficial Interest,$16.75,-0.05,-0.298%,1811261250.00,,2021,136121,Finance,Trusts Except Educational Religious and Charitable
ECC           ,Eagle Point Credit Company Inc. Common Stock,$10.29,0.04,0.39%,624217372.00,United States,2014,754094,Finance,Trusts Except Educational Religious and Charitable
ECC^D,Eagle Point Credit Company Inc. 6.75% Series D Preferred Stock,$19.73,-0.01,-0.051%,,United States,,6384,,
ECCC,Eagle Point Credit Company Inc. 6.50% Series C Term Preferred Stock due 2031,$22.45,0.0201,0.09%,1361873664.00,United States,,6894,Finance,Trusts Except Educational Religious and Charitable
ECCF,Eagle Point Credit Company Inc. 8.00% Series F Term Preferred Stock due 2029,$24.82,-0.1299,-0.521%,27020859591.00,United States,,11819,,
ECCV,Eagle Point Credit Company Inc. 5.375% Notes due 2029,$22.62,0.07,0.31%,1372186293.00,United States,2022,413,Finance,Trusts Except Educational Religious and Charitable
ECCW,Eagle Point Credit Company Inc. 6.75% Notes due 2031,$24.0539,0.2039,0.855%,1459170286.00,United States,2021,1706,Finance,Trusts Except Educational Religious and Charitable
ECCX,Eagle Point Credit Company Inc. 6.6875% Notes due 2028,$24.09,-0.1254,-0.518%,1461360203.00,United States,2022,2004,Finance,Trusts Except Educational Religious and Charitable
ECL,Ecolab Inc. Common Stock,$233.23,0.31,0.133%,66603438623.00,United States,,1449820,Consumer Discretionary,Package Goods/Cosmetics
ECO,Okeanis Eco Tankers Corp. Common Stock,$32.63,0.39,1.21%,0.00,,,43628,Consumer Discretionary,Marine Transportation
ECVT,Ecovyst Inc. Common Stock,$9.83,0.07,0.717%,1150163927.00,United States,2017,701111,Industrials,Major Chemicals
ED,Consolidated Edison Inc. Common Stock,$97.57,0.07,0.072%,33743092752.00,United States,,2179655,Utilities,Power Generation
EDD,Morgan Stanley Emerging Markets Domestic Debt Fund Inc. Common Stock,$4.60,-0.02,-0.433%,0.00,United States,2007,154404,Finance,Finance Companies
EDF,Virtus Stone Harbor Emerging Markets Income Fund Common Shares of Beneficial Interest,$5.55,0.01,0.181%,0.00,United States,2010,77405,Finance,Investment Managers
EDN,Empresa Distribuidora Y Comercializadora Norte S.A. (Edenor) American Depositary Shares,$20.00,-0.20,-0.99%,906455100.00,Argentina,2007,112493,Utilities,Electric Utilities: Central
EDR,Endeavor Group Holdings Inc. Class A Common Stock,$26.47,0.01,0.038%,18329827544.00,United States,2021,1549818,Consumer Discretionary,Services-Misc. Amusement & Recreation
EDU,New Oriental Education & Technology Group Inc. Sponsored ADR representing 10 Ordinary Share (Cayman Islands),$82.32,0.68,0.833%,13624983155.00,China,2006,1372436,Real Estate,Other Consumer Services
EE,Excelerate Energy Inc. Class A Common Stock,$18.21,0.13,0.719%,1971866062.00,United States,2022,255280,Utilities,Oil/Gas Transmission
EEA,The European Equity Fund Inc. Common Stock,$9.10,0.0744,0.824%,0.00,United States,,16411,Finance,Trusts Except Educational Religious and Charitable
EEX,Emerald Holding Inc. Common Stock,$5.83,0.08,1.391%,367469226.00,United States,2017,39591,Consumer Discretionary,Business Services
EFC,Ellington Financial Inc. Common Stock ,$11.75,0.13,1.119%,999974503.00,United States,2010,1410524,Finance,Real Estate
EFC^A,Ellington Financial Inc. 6.750% Series A Fixed-to-Floating Rate Cumulative Redeemable Preferred Stock,$24.14,0.03,0.124%,,United States,,13041,,
EFC^B,Ellington Financial Inc. 6.250% Series B Fixed-Rate Reset Cumulative Redeemable Preferred Stock,$20.84,-0.09,-0.43%,,United States,,6202,,
EFC^C,Ellington Financial Inc. 8.625% Series C Fixed-Rate Reset Cumulative Redeemable Preferred Stock,$23.98,-0.15,-0.622%,,United States,,3752,,
EFC^D,Ellington Financial Inc. 7.00% Series D Cumulative Perpetual Redeemable Preferred Stock,$21.75,0.00,0.00%,,United States,,49,,
EFC^E,Ellington Financial Inc. 8.250% Series E Fixed-to-Floating Rate Cumulative Redeemable Preferred Stock,$25.3899,0.0999,0.395%,,United States,,1678,,
EFR,Eaton Vance Senior Floating-Rate Fund Common Shares of Beneficial Interest,$13.34,0.15,1.137%,0.00,United States,2003,350121,Finance,Trusts Except Educational Religious and Charitable
EFT,Eaton Vance Floating Rate Income Trust Common Shares of Beneficial Interest,$13.56,0.10,0.743%,394466027.00,United States,2004,178553,Finance,Finance Companies
EFX,Equifax Inc. Common Stock,$234.30,-2.44,-1.031%,28962129933.00,United States,,519654,Finance,Finance: Consumer Services
EFXT,Enerflex Ltd Common Shares,$4.78,-1.33,-21.768%,592513815.00,Canada,2022,633218,Industrials,Industrial Machinery/Components
EG,Everest Group Ltd. Common Stock,$380.97,2.33,0.615%,16556287598.00,Bermuda,,196096,Finance,Property-Casualty Insurers
EGF,Blackrock Enhanced Government Fund Inc. Common Stock,$9.31,-0.03,-0.321%,0.00,United States,2005,540,Finance,Trusts Except Educational Religious and Charitable
EGO,Eldorado Gold Corporation Ordinary Shares,$15.09,0.15,1.004%,3065357717.00,Canada,,933580,,
EGP,EastGroup Properties Inc. Common Stock,$161.68,-0.35,-0.216%,7783972364.00,United States,,326556,Real Estate,Real Estate Investment Trusts
EGY,VAALCO Energy Inc.  Common Stock,$6.05,-0.26,-4.12%,624808747.00,United States,,1286528,Energy,Oil & Gas Production
EHAB,Enhabit Inc. Common Stock,$9.70,-0.20,-2.02%,486512618.00,United States,2022,367500,Health Care,Medical/Nursing Services
EHC,Encompass Health Corporation Common Stock,$85.29,-0.59,-0.687%,8587450687.00,United States,,519264,Health Care,Hospital/Nursing Management
EHI,Western Asset Global High Income Fund Inc Common Stock,$7.01,-0.02,-0.284%,0.00,United States,2003,32039,Finance,Investment Managers
EIC,Eagle Point Income Company Inc. Common Stock,$15.85,0.01,0.063%,141193512.00,,2019,60244,Finance,Finance/Investors Services
EICA,Eagle Point Income Company Inc. 5.00% Series A Term Preferred Stock due 2026,$23.32,0.00,0.00%,207737079.00,,2021,1977,Finance,Finance/Investors Services
EICB,Eagle Point Income Company Inc. 7.75% Series B Term Preferred Stock Due 2028,$24.75,-0.06,-0.242%,0.00,,,1213,,
EICC,Eagle Point Income Company Inc. 8.00% Series C Term Preferred Stock due 2029,$24.9999,-0.002,-0.008%,0.00,,,15128,,
EIG,Employers Holdings Inc Common Stock,$43.37,0.53,1.237%,1099147768.00,United States,2007,65161,Finance,Property-Casualty Insurers
EIX,Edison International Common Stock,$73.85,-0.04,-0.054%,28414013481.00,United States,,1579890,Utilities,Electric Utilities: Central
EL,Estee Lauder Companies Inc. (The) Common Stock,$129.53,0.04,0.031%,46444787148.00,United States,1995,2981154,Consumer Discretionary,Package Goods/Cosmetics
ELAN,Elanco Animal Health Incorporated Common Stock,$16.89,3.37,24.926%,8326263486.00,United States,2018,19727785,Health Care,Biotechnology: Pharmaceutical Preparations
ELC,Entergy Louisiana Inc. Collateral Trust Mortgage Bonds 4.875 % Series due September 1 2066,$21.60,-0.24,-1.099%,4605931123.00,United States,2016,15716,Utilities,Electric Utilities: Central
ELF,e.l.f. Beauty Inc. Common Stock,$161.38,-2.23,-1.363%,8957709009.00,United States,2016,803442,Consumer Discretionary,Package Goods/Cosmetics
ELME,Elme Communities Common Stock,$15.25,-0.24,-1.549%,1342062251.00,United States,2000,370533,Real Estate,Real Estate Investment Trusts
ELP,Companhia Paranaense de Energia (COPEL) American Depositary Shares (each representing one Unit consisting one Common Share and four non-voting Class B Preferred Shares),$7.56,0.05,0.666%,2457656397.00,Brazil,2021,210706,Utilities,Electric Utilities: Central
ELPC,Companhia Paranaense de Energia (COPEL) American Depositary Shares (each representing four (4) Common Shares),$6.71,-0.06,-0.886%,2181332596.00,Brazil,2023,15191,Utilities,Electric Utilities: Central
ELS,Equity Lifestyle Properties Inc. Common Stock,$62.73,-0.27,-0.429%,11698885361.00,United States,,1174498,Real Estate,Real Estate Investment Trusts
ELV,Elevance Health Inc. Common Stock,$533.35,-2.82,-0.526%,123960069364.00,United States,,778951,Health Care,Medical Specialities
EMD,Western Asset Emerging Markets Debt Fund Inc Common Stock,$9.30,-0.05,-0.535%,0.00,United States,,225041,Finance,Finance/Investors Services
EME,EMCOR Group Inc. Common Stock,$379.43,4.04,1.076%,17831783723.00,United States,,357828,Industrials,Engineering & Construction
EMF,Templeton Emerging Markets Fund Common Stock,$12.29,0.01,0.081%,0.00,United States,1987,16241,Finance,Finance/Investors Services
EMN,Eastman Chemical Company Common Stock,$100.76,0.13,0.129%,11854363519.00,United States,,717397,Industrials,Major Chemicals
EMO,ClearBridge Energy Midstream Opportunity Fund Inc. Common Stock,$42.085,0.345,0.827%,0.00,United States,2011,13012,Finance,Investment Managers
EMP,Entergy Mississippi LLC First Mortgage Bonds 4.90% Series Due October 1 2066,$22.109,-0.181,-0.812%,4721088118.00,United States,2016,6825,Utilities,Electric Utilities: Central
EMR,Emerson Electric Company Common Stock,$112.65,5.25,4.888%,64402005000.00,United States,,6058451,Technology,Consumer Electronics/Appliances
ENB,Enbridge Inc Common Stock,$37.23,0.40,1.086%,79135580034.00,Canada,,5837540,Energy,Oil & Gas Production
ENFN,Enfusion Inc. Class A Common Stock,$9.77,0.04,0.411%,1251243040.00,United States,2021,280145,Technology,Computer Software: Prepackaged Software
ENIC,Enel Chile S.A. American Depositary Shares (Each representing 50 shares of Common Stock),$3.05,0.09,3.041%,4219159989.00,Chile,2016,244022,Utilities,Electric Utilities: Central
ENJ,Entergy New Orleans LLC First Mortgage Bonds 5.0% Series due December 1 2052,$21.58,-0.15,-0.69%,4608127079.00,United States,,426,Utilities,Power Generation
ENLC,EnLink Midstream LLC Common Units representing Limited Partner Interests,$13.31,0.15,1.14%,6006858383.00,United States,,2440222,Utilities,Natural Gas Distribution
ENO,Entergy New Orleans LLC First Mortgage Bonds 5.50% Series due April 1 2066,$22.90,-0.19,-0.823%,4889995834.00,United States,2016,6040,Utilities,Power Generation
ENOV,Enovis Corporation Common Stock,$50.67,-1.57,-3.005%,2779295407.00,United States,,788928,Health Care,Industrial Specialties
ENR,Energizer Holdings Inc. Common Stock,$29.29,0.32,1.105%,2102504592.00,United States,2015,498181,Miscellaneous,Industrial Machinery/Components
ENS,EnerSys Common Stock,$95.73,0.58,0.61%,3869021287.00,United States,2004,172181,Technology,Industrial Machinery/Components
ENV,Envestnet Inc Common Stock,$63.76,1.00,1.593%,3493333442.00,United States,2010,741464,Consumer Discretionary,Business Services
ENVA,Enova International Inc. Common Stock,$61.47,-1.13,-1.805%,1667046422.00,United States,2014,165437,Finance,Finance: Consumer Services
ENZ,Enzo Biochem Inc. Common Stock ($0.01 Par Value),$1.12,0.03,2.752%,57372822.00,United States,1988,92722,Health Care,Medical Specialities
EOD,Allspring Global Dividend Opportunity Fund Common Shares of Beneficial Interest,$4.715,-0.025,-0.527%,0.00,United States,2007,108396,Finance,Investment Managers
EOG,EOG Resources Inc. Common Stock,$129.83,-0.43,-0.33%,74614679016.00,United States,,2804790,Energy,Oil & Gas Production
EOI,Eaton Vance Enhance Equity Income Fund Eaton Vance Enhanced Equity Income Fund Shares of Beneficial Interest,$18.20,-0.38,-2.045%,0.00,United States,2004,191700,Finance,Finance/Investors Services
EOS,Eaton Vance Enhance Equity Income Fund II Common Stock,$20.33,-0.37,-1.787%,0.00,,2005,104382,Finance,Trusts Except Educational Religious and Charitable
