Symbol,Name,Last Sale,Net Change,% Change,Market Cap,Country,IPO Year,Volume,Sector,Industry
PHK,Pimco High Income Fund,$4.79,-0.01,-0.208%,0.00,United States,2003,1308830,Finance,Finance/Investors Services
PHM,PulteGroup Inc. Common Stock,$115.79,-1.16,-0.992%,24355513264.00,United States,,1293393,Consumer Discretionary,Homebuilding
PHR,Phreesia Inc. Common Stock,$21.94,-0.66,-2.92%,1237141136.00,United States,2019,266212,Consumer Discretionary,Business Services
PHT,Pioneer High Income Fund Inc.,$7.52,0.03,0.401%,0.00,United States,,50516,Finance,Investment Managers
PHX,PHX Minerals Inc. Common Stock,$3.43,0.10,3.003%,128413153.00,United States,2003,34917,Energy,Oil & Gas Production
PHYT,Pyrophyte Acquisition Corp. Class A Ordinary Shares,$11.37,0.00,0.00%,0.00,,2021,581,Finance,Blank Checks
PII,Polaris Inc. Common Stock,$84.52,0.41,0.487%,4776522879.00,United States,,544283,Consumer Discretionary,Recreational Games/Products/Toys
PIM,Putnam Master Intermediate Income Trust Common Stock,$3.19,0.005,0.157%,160308327.00,United States,1988,62309,Finance,Finance Companies
PINE,Alpine Income Property Trust Inc. Common Stock,$15.49,0.12,0.781%,211023972.00,United States,2019,38002,Real Estate,Real Estate Investment Trusts
PINS,Pinterest Inc. Class A Common Stock,$42.64,0.74,1.766%,29130364238.00,United States,2019,12262219,Technology,Computer Software: Programming Data Processing
PIPR,Piper Sandler Companies Common Stock,$212.27,-0.21,-0.099%,3753480620.00,United States,,88637,Finance,Investment Bankers/Brokers/Service
PJT,PJT Partners Inc. Class A Common Stock,$99.34,-0.09,-0.091%,2382719471.00,United States,2015,140155,Finance,Investment Managers
PK,Park Hotels & Resorts Inc. Common Stock ,$15.80,-0.33,-2.046%,3327441401.00,United States,2016,2130785,Consumer Discretionary,Hotels/Resorts
PKE,Park Aerospace Corp. Common Stock,$14.65,0.09,0.618%,296711739.00,United States,,36722,Industrials,Military/Government/Technical
PKG,Packaging Corporation of America Common Stock,$178.54,-0.61,-0.34%,16001490206.00,United States,2000,417346,Consumer Discretionary,Containers/Packaging
PKST,Peakstone Realty Trust Common Shares,$13.45,-0.30,-2.182%,488315122.00,United States,2023,100981,Real Estate,Real Estate Investment Trusts
PKX,POSCO Holdings Inc. American Depositary Shares (Each representing 1/4th of a share of Common Stock),$73.35,-1.12,-1.504%,22262079134.00,South Korea,1994,56017,Industrials,Steel/Iron Ore
PL,Planet Labs PBC Class A Common Stock,$2.05,0.05,2.50%,595771379.00,United States,2021,1536074,Technology,Radio And Television Broadcasting And Communications Equipment
PLD,Prologis Inc. Common Stock,$105.88,-1.88,-1.745%,98028362720.00,United States,,2947689,Real Estate,Real Estate Investment Trusts
PLNT,Planet Fitness Inc. Common Stock,$61.85,-0.17,-0.274%,5451886507.00,United States,2015,2214430,Consumer Discretionary,Hotels/Resorts
PLOW,Douglas Dynamics Inc. Common Stock,$24.22,0.40,1.679%,559337818.00,United States,2010,189522,Industrials,Construction/Ag Equipment/Trucks
PLTR,Palantir Technologies Inc. Class A Common Stock,$21.56,0.16,0.748%,47706523308.00,United States,2020,67346266,Technology,Computer Software: Prepackaged Software
PLYM,Plymouth Industrial REIT Inc. Common Stock,$20.49,-0.17,-0.823%,929878737.00,United States,2017,185195,Real Estate,Real Estate Investment Trusts
PM,Philip Morris International Inc Common Stock,$98.25,0.72,0.738%,152735221910.00,United States,,5784266,Health Care, Medicinal Chemicals and Botanical Products 
PMF,PIMCO Municipal Income Fund Common Stock,$9.21,0.00,0.00%,0.00,United States,2001,38676,Finance,Finance/Investors Services
PML,Pimco Municipal Income Fund II Common Shares of Beneficial Interest,$8.47,0.03,0.355%,0.00,United States,2002,107059,Finance,Investment Managers
PMM,Putnam Managed Municipal Income Trust Common Stock,$6.01,0.02,0.334%,292920242.00,United States,1989,141247,Finance,Investment Managers
PMO,Putnam Municipal Opportunities Trust Common Stock,$9.978,0.049,0.494%,339068076.00,United States,1993,187337,Finance,Finance Companies
PMT,PennyMac Mortgage Investment Trust Common Shares of Beneficial Interest,$14.60,-0.03,-0.205%,1267943526.00,United States,2009,321781,Real Estate,Real Estate Investment Trusts
PMT^A,PennyMac Mortgage Investment Trust 8.125% Series A Fixed-to-Floating Rate Cumulative Redeemable Preferred Shares of Beneficial Interest,$23.60,-0.098,-0.414%,,United States,,4100,,
PMT^B,PennyMac Mortgage Investment Trust 8.00% Series B Fixed-to-Floating Rate Cumulative Redeemable Preferred Shares of Beneficial Interest,$23.3369,-0.143,-0.609%,,United States,,8927,,
PMT^C,PennyMac Mortgage Investment Trust 6.75% Series C Cumulative Redeemable Preferred Shares of Beneficial Interest,$19.095,-0.1449,-0.753%,,United States,,33045,,
PMTU,PennyMac Mortgage Investment Trust 8.50% Senior Notes due 2028,$25.50,0.01,0.039%,0.00,United States,2023,5816,,
PMX,PIMCO Municipal Income Fund III Common Shares of Beneficial Interest,$7.52,-0.02,-0.265%,0.00,United States,2002,110925,Finance,Trusts Except Educational Religious and Charitable
PNC,PNC Financial Services Group Inc. (The) Common Stock,$157.21,1.06,0.679%,62554987768.00,United States,,1254443,Finance,Major Banks
PNF,PIMCO New York Municipal Income Fund Common Stock,$7.79,0.0401,0.517%,0.00,United States,2001,11274,Finance,Finance Companies
PNI,Pimco New York Municipal Income Fund II Common Shares of Beneficial Interest,$7.40,0.00,0.00%,0.00,United States,2002,16875,Finance,Trusts Except Educational Religious and Charitable
PNM,PNM Resources Inc. (Holding Co.) Common Stock,$37.97,-0.45,-1.171%,3424908580.00,United States,,495994,Utilities,Electric Utilities: Central
PNNT,PennantPark Investment Corporation Common Stock,$7.23,0.07,0.978%,471573135.00,United States,2022,323880,Finance,Finance: Consumer Services
PNR,Pentair plc. Ordinary Share,$83.36,0.34,0.41%,13839812573.00,Switzerland,,986693,Industrials,Fluid Controls
PNST,Pinstripes Holdings Inc. Class A Common Stock,$3.07,0.04,1.32%,123069503.00,,2022,7026,Consumer Discretionary,Restaurants
PNW,Pinnacle West Capital Corporation Common Stock,$76.63,0.22,0.288%,8702017358.00,United States,,869529,Utilities,Electric Utilities: Central
POR,Portland General Electric Co Common Stock,$44.06,-0.37,-0.833%,4539558109.00,United States,,843347,Utilities,Electric Utilities: Central
POST,Post Holdings Inc. Common Stock,$105.78,0.35,0.332%,6408774069.00,United States,2012,490716,Consumer Staples,Packaged Foods
PPG,PPG Industries Inc. Common Stock,$133.43,-0.78,-0.581%,31289335000.00,United States,,1372115,Consumer Discretionary,Paints/Coatings
PPL,PPL Corporation Common Stock,$28.52,0.17,0.60%,21040369299.00,United States,,7236996,Utilities,Electric Utilities: Central
PPT,Putnam Premier Income Trust Common Stock,$3.52,-0.01,-0.283%,350339486.00,United States,1988,67361,Finance,Finance Companies
PR,Permian Resources Corporation Class A Common Stock,$17.27,-0.28,-1.595%,13330059624.00,United States,2022,13753031,Energy,Oil & Gas Production
PRA,ProAssurance Corporation Common Stock,$14.72,-0.44,-2.902%,750285083.00,United States,,294702,Finance,Property-Casualty Insurers
PRE^J,PartnerRe Ltd. 4.875% Fixed Rate Non-Cumulative Redeemable Preferred Shares Series J,$19.90,-0.10,-0.50%,,Bermuda,,8098,,
PRG,PROG Holdings Inc. Common Stock,$35.03,0.13,0.372%,1512405327.00,United States,,166205,Consumer Discretionary,Diversified Commercial Services
PRGO,Perrigo Company plc Ordinary Shares,$31.11,0.96,3.184%,4215900862.00,United States,,1711061,Health Care,Biotechnology: Pharmaceutical Preparations
PRH,Prudential Financial Inc. 5.950% Junior Subordinated Notes due 2062,$25.47,-0.31,-1.202%,9143730000.00,United States,2022,28705,Finance,Life Insurance
PRI,Primerica Inc. Common Stock,$218.17,-1.04,-0.474%,7602692602.00,United States,2010,143955,Finance,Life Insurance
PRIF^D,Priority Income Fund Inc. 7.00% Series D Term Preferred Stock due 2029,$22.78,0.00,0.00%,,,,20,,
PRIF^F,Priority Income Fund Inc. 6.625% Series F Term Preferred Stock due 2027,$23.43,0.01,0.043%,,,,6795,,
PRIF^G,Priority Income Fund Inc. 6.25% Series G Preferred Stock Due 2026,$23.65,-0.076,-0.32%,,,,1271,,
PRIF^H,Priority Income Fund Inc. 6.00% Series H Term Preferred Stock due 2026,$23.59,0.00,0.00%,,,,2534,,
PRIF^I,Priority Income Fund Inc. 6.125% Series I Term Preferred Stock due 2028,$22.20,-0.0942,-0.423%,,,,348,,
PRIF^J,Priority Income Fund Inc. 6.000% Series J Term Preferred Stock due 2028,$22.26,0.06,0.27%,,,,1076,,
PRIF^K,Priority Income Fund Inc. 7.000% Series K Cumulative Preferred Stock,$20.55,-0.1372,-0.663%,,,,1786,,
PRIF^L,Priority Income Fund Inc. 6.375% Series L Term Preferred Stock Due 2029,$22.5001,-0.2083,-0.917%,,,,2641,,
PRIM,Primoris Services Corporation Common Stock,$47.80,0.13,0.273%,2554283055.00,United States,,1329140,Industrials,Water Sewer Pipeline Comm & Power Line Construction
PRKS,United Parks & Resorts Inc. Common Stock,$51.62,2.46,5.004%,3302134910.00,United States,2013,1977734,Health Care,Biotechnology: Electromedical & Electrotherapeutic Apparatus
PRLB,Proto Labs Inc. Common stock,$31.69,0.22,0.699%,802266258.00,United States,2012,179539,Industrials,Metal Fabrications
PRM,Perimeter Solutions SA Ordinary Shares,$7.67,0.14,1.859%,1117777395.00,Luxembourg,2021,611907,Industrials,Major Chemicals
PRMW,Primo Water Corporation Common Stock,$20.11,-0.02,-0.099%,3207766371.00,Canada,,1638794,Consumer Staples,Farming/Seeds/Milling
PRO,PROS Holdings Inc. Common Stock,$30.56,-2.41,-7.31%,1428308085.00,United States,2007,556184,Technology,EDP Services
PRS,Prudential Financial Inc. 5.625% Junior Subordinated Notes due 2058,$24.08,-0.16,-0.66%,8644720000.00,United States,2018,26238,Finance,Life Insurance
PRT,PermRock Royalty Trust Trust Units,$3.93,-0.10,-2.481%,47811327.00,United States,2018,65748,Energy,Oil & Gas Production
PRU,Prudential Financial Inc. Common Stock,$116.69,0.46,0.396%,41891710000.00,United States,2001,1086043,Finance,Life Insurance
PSA,Public Storage Common Stock,$269.02,-4.18,-1.53%,47273449378.00,United States,,466451,Real Estate,Real Estate Investment Trusts
PSA^F,Public Storage Depositary Shares Each Representing 1/1000 of a 5.15% Cumulative Preferred Share of Beneficial Interest Series F par value $0.01 per share,$22.95,-0.30,-1.29%,,United States,,13287,,
PSA^G,Public Storage Depositary Shares Each Representing 1/1000 of a 5.05% Cumulative Preferred Share of Beneficial Interest Series G,$22.95,-0.30,-1.29%,,United States,,11618,,
PSA^H,Public Storage Depositary Shares Each Representing 1/1000 of a  5.60% Cumulative Preferred  Share of Beneficial Interest Series H,$24.78,-0.1441,-0.578%,,United States,,59995,,
PSA^I,Public Storage Depositary Shares Each Representing 1/1000 of a 4.875% Cumulative Preferred Share of Beneficial Interest Series I par value $0.01 per share,$21.95,-0.28,-1.26%,,United States,,9415,,
PSA^J,Public Storage Depositary Shares Each Representing 1/1000 of a 4.700% Cumulative Preferred Share of Beneficial Interest Series J par value $0.01 per share,$20.8099,-0.2318,-1.102%,,United States,,9434,,
PSA^K,Public Storage Depositary Shares Each Representing 1/1000 of a 4.75% Cumulative Preferred Share of Beneficial Interest Series K,$21.04,-0.09,-0.426%,,United States,,67144,,
PSA^L,Public Storage Depositary Shares Each Representing 1/1000 of a 4.625% Cumulative Preferred Share of Beneficial Interest Series L par value $0.01 per share,$20.59,-0.22,-1.057%,,United States,,18720,,
PSA^M,Public Storage Depositary Shares Each Representing 1/1000 of a 4.125% Cumulative Preferred Share of Beneficial Interest Series M,$18.3599,-0.2401,-1.291%,,United States,,7218,,
PSA^N,Public Storage Depositary Shares Each Representing 1/1000 of a 3.875% Cumulative Preferred Share of Beneficial Interest Series N,$17.09,-0.14,-0.813%,,United States,,9412,,
PSA^O,Public Storage Depositary Shares Each Representing 1/1000 of a 3.900% Cumulative Preferred Share of Beneficial Interest Series O,$17.11,-0.16,-0.926%,,United States,,53822,,
PSA^P,Public Storage Depositary Shares Each Representing 1/1000 of a 4.000% Cumulative Preferred Share of Bene cial Interest Series P,$17.75,-0.24,-1.334%,,United States,,26735,,
PSA^Q,Public Storage Depositary Shares Each Representing 1/1000 of a 3.950% Cumulative Preferred Share of Beneficial Interest Series Q par value $0.01 per share,$17.40,-0.20,-1.136%,,United States,,19040,,
PSA^R,Public Storage Depositary Shares Each Representing 1/1000 of a 4.00% Cumulative Preferred Share of Bene cial Interest Series R,$17.68,-0.235,-1.312%,,United States,,14245,,
PSA^S,Public Storage Depositary Shares Each Representing 1/1000 of a 4.100% Cumulative Preferred Share of Beneficial Interest Series S,$18.02,-0.255,-1.395%,,United States,,19600,,
PSBD,Palmer Square Capital BDC Inc. Common Stock,$16.57,0.02,0.121%,0.00,,2024,12268,,
PSEC^A,Prospect Capital Corporation 5.35% Series A Fixed Rate Cumulative Perpetual Preferred Stock,$17.46,-0.34,-1.91%,,United States,,6434,,
PSF,Cohen & Steers Select Preferred and Income Fund Inc. Common Stock,$19.29,-0.15,-0.772%,947884134.00,,2010,66473,Finance,Investment Managers
PSFE,Paysafe Limited Common Shares,$14.94,0.03,0.201%,922088478.00,,2021,188887,Consumer Discretionary,Business Services
PSN,Parsons Corporation Common Stock,$77.60,-0.65,-0.831%,11387625012.00,United States,2019,725724,Technology,EDP Services
PSO,Pearson Plc Common Stock,$12.67,0.17,1.36%,8699095997.00,United Kingdom,,341579,Consumer Discretionary,Books
PSQH,PSQ Holdings Inc. Class A Common Stock,$3.99,0.01,0.251%,112866139.00,,2021,38344,Consumer Discretionary,Advertising
PSTG,Pure Storage Inc. Class A Common Stock,$53.45,0.27,0.508%,17366455963.00,United States,2015,1492040,Technology,Electronic Components
PSTL,Postal Realty Trust Inc. Class A Common Stock,$13.76,-0.03,-0.218%,309762753.00,United States,2019,73722,Real Estate,Real Estate Investment Trusts
PSX,Phillips 66 Common Stock,$146.94,1.73,1.191%,62295526717.00,United States,,2918980,Energy,Integrated oil Companies
PTA,Cohen & Steers Tax-Advantaged Preferred Securities and Income Fund Common Shares of Beneficial Interest,$19.35,0.10,0.519%,1069541393.00,United States,2020,100334,Finance,Trusts Except Educational Religious and Charitable
PTY,Pimco Corporate & Income Opportunity Fund,$14.18,-0.12,-0.839%,0.00,United States,2002,535582,Finance,Investment Managers
PUK,Prudential Public Limited Company Common Stock,$19.54,0.42,2.197%,26901897786.00,United Kingdom,,746406,Finance,Life Insurance
PUMP,ProPetro Holding Corp. Common Stock,$9.47,0.00,0.00%,1013660741.00,United States,2017,1645844,Energy,Oilfield Services/Equipment
PVH,PVH Corp. Common Stock,$113.95,0.37,0.326%,6573651067.00,United States,,603661,Consumer Discretionary,Apparel
PVL,Permianville Royalty Trust Trust Units ,$1.4601,0.0151,1.045%,48183300.00,United States,2011,33355,Energy,Oil & Gas Production
PWR,Quanta Services Inc. Common Stock,$264.98,-1.90,-0.712%,38790012806.00,United States,,977812,Industrials,Engineering & Construction
PWSC,PowerSchool Holdings Inc. Class A Common Stock,$19.15,2.51,15.084%,3879662748.00,United States,2021,8795513,Technology,Computer Software: Prepackaged Software
PX,P10 Inc. Class A Common Stock,$7.59,-0.04,-0.524%,879507455.00,United States,2021,358871,Finance,Investment Managers
PYN,PIMCO New York Municipal Income Fund III Common Shares of Beneficial Interest,$5.92,0.01,0.169%,0.00,United States,2002,22190,Finance,Investment Managers
PYT,PPlus Tr GSC-2 Tr Ctf Fltg Rate,$22.8071,-0.1034,-0.451%,0.00,United States,,1069,Finance,Finance: Consumer Services
PZC,PIMCO California Municipal Income Fund III Common Shares of Beneficial Interest,$7.28,0.01,0.138%,0.00,United States,2002,32379,Finance,Investment Managers
QBTS,D-Wave Quantum Inc. Common Shares,$1.36,-0.02,-1.449%,219887689.00,,2022,2077232,Technology,EDP Services
QD,Qudian Inc. American Depositary Shares each representing one Class A Ordinary Share,$2.32,-0.12,-4.918%,439416934.00,China,2017,351250,Finance,Finance: Consumer Services
QGEN,Qiagen N.V. Common Shares,$42.94,-0.01,-0.023%,9799026300.00,Netherlands,,1097280,Health Care,Biotechnology: Biological Products (No Diagnostic Substances)
QS,QuantumScape Corporation Class A Common Stock,$5.44,-0.14,-2.509%,2717455456.00,United States,2020,4133931,Miscellaneous,Industrial Machinery/Components
QSR,Restaurant Brands International Inc. Common Shares,$73.38,-0.93,-1.252%,23216143374.00,Canada,2014,2095067,,
QTWO,Q2 Holdings Inc. Common Stock,$62.34,0.01,0.016%,3746603578.00,United States,2014,477805,Technology,EDP Services
QUAD,Quad Graphics Inc Class A Common Stock,$4.67,0.16,3.548%,242551441.00,United States,,130297,Consumer Discretionary,Publishing
QVCC,QVC Inc. 6.250% Senior Secured Notes due 2068,$12.90,-0.43,-3.226%,13.00,United States,2019,27079,Consumer Discretionary,Catalog/Specialty Distribution
QVCD,QVC Inc. 6.375% Senior Secured Notes due 2067,$12.93,-0.46,-3.435%,13.00,United States,2018,18026,Consumer Discretionary,Catalog/Specialty Distribution
R,Ryder System Inc. Common Stock,$125.46,0.14,0.112%,5498760370.00,United States,,166355,Consumer Discretionary,Rental/Leasing Companies
RA,Brookfield Real Assets Income Fund Inc. Common Stock,$12.63,-0.06,-0.473%,0.00,United States,2016,139913,Finance,Investment Managers
RACE,Ferrari N.V. Common Shares,$406.22,5.22,1.302%,73289436520.00,Italy,2015,442551,Consumer Discretionary,Auto Manufacturing
RAMP,LiveRamp Holdings Inc. Common Stock,$32.26,-0.95,-2.861%,2135087162.00,United States,2018,418082,Technology,EDP Services
RBA,RB Global Inc. Common Stock,$72.00,0.12,0.167%,13177207440.00,Canada,,850507,Consumer Discretionary,Business Services
RBC,RBC Bearings Incorporated Common Stock,$264.51,2.97,1.136%,7718909924.00,United States,2022,179498,Industrials,Metal Fabrications
RBCP,RBC Bearings Incorporated 5.00% Series A Mandatory Convertible Preferred Stock,$119.53,0.45,0.378%,3488115017.00,United States,2022,14194,Industrials,Metal Fabrications
RBLX,Roblox Corporation Class A Common Stock,$39.03,-1.51,-3.725%,24652839922.00,United States,2021,8541655,Technology,Computer Software: Prepackaged Software
RBOT,Vicarious Surgical Inc. Class A Common Stock,$0.3023,-0.0006,-0.198%,44503264.00,Hong Kong,2020,174544,Health Care,Industrial Specialties
RBRK,Rubrik Inc. Class A Common Stock,$33.57,-0.20,-0.592%,5906044357.00,,2024,704726,Technology,Computer Software: Prepackaged Software
RBT,Rubicon Technologies Inc. Class A Common Stock,$0.2794,-0.0172,-5.799%,14936077.00,,2022,558403,Technology,Semiconductors
RC,Ready Capital Corproation Common Stock,$8.45,-0.23,-2.65%,1458085728.00,United States,2013,2961707,Real Estate,Real Estate Investment Trusts
RC^C,Ready Capital Corporation 6.25% Series C Cumulative Convertible Preferred Stock,$17.75,-0.05,-0.281%,,United States,,785,,
RC^E,Ready Capital Corporation 6.50% Series E Cumulative Redeemable Preferred Stock,$18.40,-0.24,-1.288%,,United States,,7500,,
RCB,Ready Capital Corporation 6.20% Senior Notes due 2026,$24.10,0.0601,0.25%,4158564028.00,United States,2019,9229,Real Estate,Real Estate Investment Trusts
RCC,Ready Capital Corporation 5.75% Senior Notes due 2026,$24.30,0.22,0.914%,4193074933.00,United States,2021,5753,Real Estate,Real Estate Investment Trusts
RCFA,Perception Capital Corp. IV Class A Ordinary Shares,$11.23,-0.01,-0.089%,0.00,,2021,1018,Finance,Blank Checks
RCI,Rogers Communication Inc. Common Stock,$38.92,0.55,1.433%,20676817025.00,Canada,,910022,Telecommunications,Cable & Other Pay Television Services
RCL,Royal Caribbean Cruises Ltd. Common Stock,$141.68,0.09,0.064%,36461234089.00,United States,1993,1287394,Consumer Discretionary,Marine Transportation
RCS,PIMCO Strategic Income Fund Inc.,$5.78,-0.03,-0.516%,0.00,United States,1994,130256,Finance,Investment Managers
RCUS,Arcus Biosciences Inc. Common Stock,$15.26,-0.30,-1.928%,1386597291.00,United States,2018,504245,Health Care,Biotechnology: Pharmaceutical Preparations
RDDT,Reddit Inc. Class A Common Stock,$51.40,2.00,4.049%,8172244826.00,,2024,13488189,Technology,EDP Services
RDN,Radian Group Inc. Common Stock,$31.18,-0.32,-1.016%,4695036539.00,United States,,639435,Finance,Property-Casualty Insurers
RDW,Redwire Corporation Common Stock,$4.28,0.22,5.419%,280676939.00,United States,2021,228882,Industrials,Military/Government/Technical
RDY,Dr. Reddy's Laboratories Ltd Common Stock,$71.50,0.16,0.224%,11906743134.00,India,,130424,Health Care,Biotechnology: Pharmaceutical Preparations
RELX,RELX PLC PLC American Depositary Shares (Each representing One Ordinary Share),$42.94,0.05,0.117%,80857017926.00,United Kingdom,2015,526830,Consumer Discretionary,Business Services
RERE,ATRenew Inc. American Depositary Shares (every three of which representing two Class A ordinary shares),$2.45,-0.07,-2.778%,179246065.00,Cayman Islands,2021,1219033,Consumer Discretionary,Other Specialty Stores
RES,RPC Inc. Common Stock,$6.75,-0.05,-0.735%,1446842669.00,United States,,1156240,Energy,Oilfield Services/Equipment
REVG,REV Group Inc. Common Stock,$25.03,0.86,3.558%,1296559882.00,United States,2017,1048265,Consumer Discretionary,Auto Manufacturing
REX,REX American Resources Corporation,$57.82,0.21,0.365%,1012066536.00,United States,,270512,Industrials,Major Chemicals
REXR,Rexford Industrial Realty Inc. Common Stock,$44.90,-0.20,-0.443%,9780182207.00,United States,2013,1360855,Real Estate,Real Estate Investment Trusts
REXR^B,Rexford Industrial Realty Inc. 5.875% Series B Cumulative Redeemable Preferred Stock,$21.93,0.11,0.504%,,United States,,4788,,
REXR^C,Rexford Industrial Realty Inc. 5.625% Series C Cumulative Redeemable Preferred Stock par value $0.01 per share,$21.13,-0.04,-0.189%,,United States,,1154,,
REZI,Resideo Technologies Inc. Common Stock ,$21.06,0.23,1.104%,3075116462.00,United States,2018,581561,Industrials,Wholesale Distributors
RF,Regions Financial Corporation Common Stock,$19.74,0.09,0.458%,18138376308.00,United States,,9638497,Finance,Major Banks
RF^B,Regions Financial Corporation Depositary Shares Representing 1/40th Perpetual Preferred Series B,$24.92,-0.0699,-0.28%,,United States,,33361,,
RF^C,Regions Financial Corporation Depositary Shares each Representing a 1/40th Interest in a  Share of 5.700% Fixed-to-Floating Rate Non-Cumulative  Perpetual Preferred Stock Series C,$22.24,-0.12,-0.537%,,United States,,35820,,
RF^E,Regions Financial Corporation Depositary Shares Each Representing a 1/40th Interest in a Share of 4.45% Non-Cumulative Perpetual Preferred Stock Series E,$17.56,-0.24,-1.348%,,United States,,12865,,
RFI,Cohen & Steers Total Return Realty Fund Inc. Common Stock,$11.41,-0.04,-0.349%,560671745.00,United States,1993,37771,Finance,Investment Managers
RFL,Rafael Holdings Inc. Class B Common Stock,$1.61,0.01,0.625%,39580947.00,United States,2018,8650,Finance,Real Estate
RFM,RiverNorth Flexible Municipal Income Fund Inc. Common Stock,$16.25,0.00,0.00%,99363859.00,,2020,11706,Finance,Finance/Investors Services
RFMZ,RiverNorth Flexible Municipal Income Fund II Inc. Common Stock,$13.93,0.03,0.216%,339219961.00,,2021,34302,Finance,Trusts Except Educational Religious and Charitable
RGA,Reinsurance Group of America Incorporated Common Stock,$207.59,4.37,2.15%,13657766470.00,United States,,410184,Finance,Life Insurance
RGR,Sturm Ruger & Company Inc. Common Stock,$43.10,-3.23,-6.972%,761327020.00,United States,,414181,Industrials,Ordnance And Accessories
RGT,Royce Global Trust Inc. Common Stock,$10.71,-0.04,-0.372%,67118960.00,,2013,1214,Finance,Trusts Except Educational Religious and Charitable
RH,RH Common Stock,$278.76,0.32,0.115%,5105660280.00,United States,2012,492331,Consumer Discretionary,Other Specialty Stores
RHI,Robert Half Inc. Common Stock,$70.12,0.14,0.20%,7357874543.00,United States,,897104,Consumer Discretionary,Professional Services
RHP,Ryman Hospitality Properties Inc. (REIT),$104.13,-2.29,-2.152%,6236386623.00,United States,,574937,Real Estate,Real Estate Investment Trusts
RIG,Transocean Ltd (Switzerland) Common Stock,$5.75,0.03,0.524%,4712583074.00,Switzerland,,17398117,Energy,Oil & Gas Production
RIO,Rio Tinto Plc Common Stock,$69.02,-1.02,-1.456%,112303015694.00,Australia,2002,1816504,Basic Materials,Metal Mining
RITM,Rithm Capital Corp. Common Stock,$11.22,-0.09,-0.796%,5424619940.00,United States,,2382374,Real Estate,Real Estate Investment Trusts
RITM^A,Rithm Capital Corp. 7.50% Series A Fixed-to-Floating Rate Cumulative Redeemable Preferred Stock,$24.905,-0.065,-0.26%,,United States,,19628,,
RITM^B,Rithm Capital Corp. 7.125% Series B Fixed-to-Floating Rate Cumulative Redeemable Preferred Stock,$24.81,-0.05,-0.201%,,United States,,45441,,
RITM^C,Rithm Capital Corp. 6.375% Series C Fixed-to-Floating Rate Cumulative Redeemable Preferred Stock,$23.25,0.12,0.519%,,United States,,29305,,
RITM^D,Rithm Capital Corp. 7.00% Fixed-Rate Reset Series D Cumulative Redeemable Preferred Stock,$22.77,-0.09,-0.394%,,United States,,38490,,
RIV,RiverNorth Opportunities Fund Inc. Common Stock,$12.14,0.05,0.414%,0.00,,2015,39743,Finance,Finance Companies
RIV^A,RiverNorth Opportunities Fund Inc. 6.00% Series A Perpetual Preferred Stock,$22.87,-0.2082,-0.902%,,,,30265,,
RJF,Raymond James Financial Inc. Common Stock,$125.40,0.13,0.104%,26212062796.00,United States,,959455,Finance,Investment Bankers/Brokers/Service
RJF^B,Raymond James Financial Inc. Depositary Shares each representing a 1/40th interest in a share of 6.375% Fixed-to-Floating Rate Series B Non-Cumulative Perpetual Preferred Stock,$25.2399,0.0117,0.046%,,United States,,1600,,
RKT,Rocket Companies Inc. Class A Common Stock,$13.88,-0.10,-0.715%,27560675080.00,United States,2020,6805005,Finance,Finance: Consumer Services
RL,Ralph Lauren Corporation Common Stock,$165.16,-1.56,-0.936%,10557944829.00,United States,1997,684972,Consumer Discretionary,Apparel
RLI,RLI Corp. Common Stock (DE),$147.07,0.09,0.061%,6722552199.00,United States,,176442,Finance,Property-Casualty Insurers
